{
  "$schema": "http://json-schema.org/draft-07/schema#",
  "$id": "https://github.com/deep-assistant/master-plan/qa-database/schema.json",
  "title": "Question and Answer Database Schema",
  "description": "JSON Schema for the public domain question and answer database",
  "type": "object",
  "properties": {
    "version": {
      "type": "string",
      "description": "Version of the database schema",
      "pattern": "^\\d+\\.\\d+\\.\\d+$"
    },
    "metadata": {
      "type": "object",
      "description": "Metadata about the database",
      "properties": {
        "title": {
          "type": "string",
          "description": "Title of the database"
        },
        "description": {
          "type": "string",
          "description": "Description of the database purpose and content"
        },
        "license": {
          "type": "string",
          "description": "License for the database content (e.g., CC0-1.0, Public Domain)"
        },
        "created": {
          "type": "string",
          "format": "date-time",
          "description": "Creation date of the database"
        },
        "updated": {
          "type": "string",
          "format": "date-time",
          "description": "Last update date of the database"
        },
        "contributors": {
          "type": "array",
          "description": "List of contributors to the database",
          "items": {
            "type": "string"
          }
        }
      },
      "required": ["title", "license"]
    },
    "categories": {
      "type": "array",
      "description": "Categories for organizing questions and answers",
      "items": {
        "type": "object",
        "properties": {
          "id": {
            "type": "string",
            "description": "Unique identifier for the category"
          },
          "name": {
            "type": "string",
            "description": "Name of the category"
          },
          "description": {
            "type": "string",
            "description": "Description of the category"
          }
        },
        "required": ["id", "name"]
      }
    },
    "entries": {
      "type": "array",
      "description": "Question and answer entries",
      "items": {
        "type": "object",
        "properties": {
          "id": {
            "type": "string",
            "description": "Unique identifier for the Q&A entry"
          },
          "question": {
            "type": "string",
            "description": "The question text"
          },
          "answer": {
            "type": "string",
            "description": "The answer text"
          },
          "category": {
            "type": "string",
            "description": "Category ID this entry belongs to"
          },
          "tags": {
            "type": "array",
            "description": "Tags for searchability and organization",
            "items": {
              "type": "string"
            }
          },
          "source": {
            "type": "string",
            "description": "Source of the Q&A (e.g., 'automated', 'teacher-reviewed', 'community')"
          },
          "verified": {
            "type": "boolean",
            "description": "Whether the answer has been verified by a teacher or expert"
          },
          "created": {
            "type": "string",
            "format": "date-time",
            "description": "Creation date of the entry"
          },
          "updated": {
            "type": "string",
            "format": "date-time",
            "description": "Last update date of the entry"
          },
          "metadata": {
            "type": "object",
            "description": "Additional metadata for the entry",
            "properties": {
              "difficulty": {
                "type": "string",
                "enum": ["beginner", "intermediate", "advanced"],
                "description": "Difficulty level of the question"
              },
              "language": {
                "type": "string",
                "description": "Language of the Q&A (ISO 639-1 code, e.g., 'en', 'ru')"
              },
              "references": {
                "type": "array",
                "description": "References or citations for the answer",
                "items": {
                  "type": "string"
                }
              }
            }
          }
        },
        "required": ["id", "question", "answer"]
      }
    }
  },
  "required": ["version", "metadata", "entries"]
}
